
S. No.,Titles of the Research Paper,Name of the Journal,"ISSN
Number
","Year, volume number and pagination details",Are you First/ Corresponding/ Co- author,Total number of author/s,Impact factor of the journal ,Link of the journal website ,Link of the paper available on website
1,Laboratory Evaluation of Stiffness in Prefabricated Vertical Drains for Consolidation of Soft Kaolin Soil under Radial Flow,Springer Proceedings under ,,GeoMandu 2024,Yes,2,Aceepted and Under Process for Publication,Aceepted and Under Process for Publication,Aceepted and Under Process for Publication
2,Experimental Study on Performance of Prefabricated Vertical Drain on Kaolinite with Various Drain Material,Springer Nature link,,IGC 2022 (Published in 2024),Yes,3,,https://link.springer.com/chapter/10.1007/978-981-97-1745-3_5,https://link.springer.com/chapter/10.1007/978-981-97-1745-3_5
3,Cost Effective Optimization of Prefabrication jute Drains with Polyamide Polyester Geosynthetics for soft Kadlin Soil Improvement,Springer Proceedings under IGC 2024 – Ground Improvement technique-1,,IGC-2024,Yes,2,Aceepted and Under Process for Publication,Aceepted and Under Process for Publication,Aceepted and Under Process for Publication
4,Enhancing Soil Consolidation of Coastal Soils : Investigating the Role of Sawdust Vertical Drain Material of Cross Shape and Circular Shape Using Modified Rowe Type Oedometer,Springer Proceedings under WIGC 2024 – Ground Improvement technique-1,,WIGC-2024,Yes,2,Aceepted and Under Process for Publication,Aceepted and Under Process for Publication,Aceepted and Under Process for Publication
5,"""Influence of Spacing of Drains on Rate of Settlement Reduction in Soft Soils”",Springer Proceedings under WIGC 2024 – Ground Improvement technique-1,,GEO Practices- 2024,Yes,2,Aceepted and Under Process for Publication,Aceepted and Under Process for Publication,Aceepted and Under Process for Publication
6,Co-relation and compaCCo relation and Comparison of allowable bearing pressure by different methods ,AIP Conference Proceedings,"Volume 3241, ",PICET 2024,No,2,NA,https://doi.org/10.1063/5.0178671 ,https://pubs.aip.org/aip/acp/article-abstract/2855/1/050010/2928984/Co-relation-and-comparison-of-allowable-bearing?redirectedFrom=fulltext 
7,Influence of Triangular Pattern Darain Spacing on Consolidation and Settlement  Reduction in Soft soils,Springer Proceedings under IGC 2023 – Ground Improvement technique-1,,IGC 2023,Yes,2,Aceepted and Under Process for Publication,Aceepted and Under Process for Publication,Aceepted and Under Process for Publication
8,Experimental study of ground improvement techniques of soft Kaolin soil using sand drain and jute wrapped with polyamide polyester vertical drain”,Material Today Proceedings,,NBL 2023,Yes,2,,https://doi.org/10.1016/j.matpr.2024.02.036,https://www.sciencedirect.com/science/article/abs/pii/S2214785324000993
9,IoT-Enabled Monitoring of Prefabricated Drain Performance for Ground Improvement—A Review,Springer Nature Singapore,,International Conference on Interdisciplinary Approaches in Civil Engineering for Sustainable Development 2023,Yes,2,,https://link.springer.com/chapter/10.1007/978-981-97-0072-1_26,https://link.springer.com/chapter/10.1007/978-981-97-0072-1_26
10,Effect of Influence Zone Related to Size of Drain,Conference Proceedings,,NCIET- 2021,Yes,2,,,http://nciet.srpec.org.in/
11,Theoretical Simulation of Ecperimental Results with Barron’s Theory for Consolidation of Soft clay by Radial flow using PVD,Springer Book Chapter,,IGC-2020 (Year of Publication 2022),Yes,2,,,https://link.springer.com/chapter/10.1007/978-981-16-5605-7_25
12,Study of Strength Parameter for Different Drain Material using PVD for Consolidation of soft Clay by Radial Flow,"International Journal of Engineering Research & Technology (IJERT)

",ISSN: 2278-0181,IJERT-2020,Yes,2,,,https://www.ijert.org/?s=Study+of+Strength+Parameter+for+Different+Drain+Material+using+PVD+for+Consolidation+of+soft+Clay+by+Radial+Flow
13,Consolidation of Soft clay by Radial Dissipation of Pore water Pressure using  PVD- Experimental and theoretical simulation,Conference Proceedings,,ICGEE- 2020,Yes,2,,,https://www.easychair.org/cfp/ICGEE-2020
14,Consolidation By Radial Drainage Of Soft Kaolinitic Clay Using Different Types Of Vertical Drains,Conference Proceedings,,ICGGE- 2019,Yes,2,,,https://drive.google.com/drive/folders/1AYKWIhH836JVPHWSUC1hZH4oHGWZmiRi
15,Study of Radial Pore water Pressure Dissipation during Consolidation Using Plus and Circular Shape Saw dust drain,Conference Proceedings,,IGC-2018,Yes,,,,https://scholar.google.com/citations?view_op=view_citation&hl=en&user=vewwrW8AAAAJ&sortby=pubdate&citation_for_view=vewwrW8AAAAJ:_kc_bZDykSQC
16,Statistical Approach for Three Dimensional Consolidation Using Saw Dust Drain,Conference Proceedings,,IGC-2017,Yes,3,,,https://scholar.google.com/citations?view_op=list_works&hl=en&hl=en&user=vewwrW8AAAAJ&sortby=pubdate
17,Consolidation of Kaolinitic clay Using Saw dust Drain,Conference Proceedings,,IGC 2016,Yes,3,NA,,https://scholar.google.com/citations?view_op=view_citation&hl=en&user=vewwrW8AAAAJ&sortby=pubdate&citation_for_view=vewwrW8AAAAJ:8k81kl-MbHgC
18,Review on “ Effect of Smear on Consolidation by Radial Seepage Flow Using PVD”,International Journal of Advance Engineering and Research Development,,2015,,,,,https://www.ijaerd.org/index.php/IJAERD/article/view/5753
19,Effect of Natural Fibers as Reinforcing Material on Bearing Capacity of the Sandy Bed,Conference Proceedings,ISBN: 978-81-927554-1-0,RACSE-14,Yes,3,,,
20, Comparative Study of Prefabricated Jute drain with different Geodrains in Soft Clays on Radial Pore Pressure Dissipation during Consolidation ,Conference Proceedings,,NCIET - 2013,Yes,2,NA,,
21,  Influence of Vertical Prefabricated Circular Jute Geodrain on Radial Pore Pressure Dissipation during Consolidation ,Conference Proceedings,,ICADET-  2013,Yes,3,,,
22,"Critical 
Appraisal of consolidation. by Radial Seepage flow Using PVD Reinfoced clay Beds.
",Conference Proceedings,,NCEVT 2012,Yes,3,NA,,
23,Ground Improvement techniques for Coastal Soils,Conference Proceedings,,Emerging Vistas of Technology in 21st Century 2009,Yes,3,NA,,
24,E Waste Management,Conference Proceedings,,Emerging Vistas of Technology in 21st Century 2009,Yes,3,NA,,
